{
  "id": "example-users-table",
  "title": "User Directory",
  "description": "A simple table displaying user information with sorting and pagination",
  "created_at": "2025-10-10T00:00:00Z",
  "data_shape": "tabular",
  "root": {
    "layout": {
      "type": "stack",
      "direction": "vertical",
      "id": "root-layout",
      "spacing": "normal",
      "children": [
        {
          "type": "component",
          "component_id": "users-table"
        }
      ]
    },
    "nodes": {
      "users-table": {
        "id": "users-table",
        "type": "data-table",
        "config": {
          "type": "data-table",
          "title": "Users",
          "description": "List of all users in the system",
          "affordances": [
            {
              "type": "sorting",
              "allowed_fields": [
                { "accessor": "name" },
                { "accessor": "email" },
                { "accessor": "created_at" }
              ],
              "default_field": { "accessor": "name" },
              "default_direction": "asc"
            },
            {
              "type": "pagination",
              "page_size": 25,
              "show_size_options": true,
              "size_options": [10, 25, 50, 100]
            },
            {
              "type": "search",
              "searchable_fields": [
                { "accessor": "name" },
                { "accessor": "email" }
              ],
              "min_characters": 2,
              "case_sensitive": false
            }
          ]
        }
      }
    },
    "accessor_bindings": {
      "users-table": {
        "name": {
          "roles": ["label", "sortable", "searchable"],
          "data_types": ["string"]
        },
        "email": {
          "roles": ["label", "sortable", "searchable"],
          "data_types": ["string"],
          "format": "email"
        },
        "created_at": {
          "roles": ["timestamp", "sortable"],
          "data_types": ["date"],
          "format": "iso8601"
        },
        "status": {
          "roles": ["categorical"],
          "data_types": ["string"],
          "value_mappings": {
            "active": {
              "display_value": "Active",
              "display_config": {
                "type": "chip",
                "details": {
                  "color": "green",
                  "icon": "check-circle"
                }
              }
            },
            "inactive": {
              "display_value": "Inactive",
              "display_config": {
                "type": "chip",
                "details": {
                  "color": "grey"
                }
              }
            },
            "suspended": {
              "display_value": "Suspended",
              "display_config": {
                "type": "chip",
                "details": {
                  "color": "red",
                  "icon": "alert-circle"
                }
              }
            }
          }
        }
      }
    }
  }
}
